;title;date;description;price;keys;path
0;Alquiler Departamentos Garzonier Baño;2023-02-24;ALQUILER Departamentos, garzonier, baño, cocina, Capitàn Ustariz Km. 8, celular 64970699, 72740939, 76429401, 76962664;;Cochabamba -  Alquiler -  Departamento;/anuncio/inmuebles/alquiler-departamentos-garzonier-bano/1973277
1;13 900 $us Monoambientes;2023-02-24;13.900 $US monoambientes, 35.000 $us, departamentos, preventa, frente iglesia Cala Cala. 79786019.;$us 13 900;Cochabamba -  Venta -  Departamento;/anuncio/inmuebles/13-900-us-monoambientes/1976080
2;65 000 $us Prado;2023-02-24;65.000 $US Prado, inmediaciones, departamento, céntrico, acepto financiamiento. 79786019.;$us 65 000;Cochabamba -  Venta -  Departamento;/anuncio/inmuebles/65-000-us-prado/1976313
3;85 000 $us Departamento;2023-02-24;85.000 $US departamento en anticrético, 1 dormitorio, sala, cocina y baño, zona norte. 75984046, 74571393, 4470200.;$us 85 000;Cochabamba -  Anticrético -  Departamento;/anuncio/inmuebles/85-000-us-departamento/1978634
4;Edificio Verona Calle Inti;2023-02-24;"EDIFICIO ""VERONA"" Calle Inti Raymi casi Av. América frente al Parque José Marti. Departamentos a estrenar de: 1, 2, 3, 4 dormitorios. Acabado de primera calidad. Edificio con piscina, sauna, parrillero y área social. Cel. 67598803.";;Cochabamba -  Venta -  Departamento;/anuncio/inmuebles/edificio-verona-calle-inti/1978824
5;Edificio Tribeca Soho Av;2023-02-24;"EDIFICIO ""TRIBECA SOHO"" Av. Heroínas Esq. Aurelio Melean. Departamentos a estrenar de: 1, 2, 3, 4 dormitorios. Acabado de primera calidad. Edificio con: piscina, sauna, parrillero y área social. Cel. 74577718, Cel. Of. 72202293.";;Cochabamba -  Venta -  Departamento;/anuncio/inmuebles/edificio-tribeca-soho-av/1978825
6;27 900 $us Monoambiente;2023-02-24;27.900 $US monoambiente, a estrenar, frente a parque zona Iglesia Cala Cala. 79786019.;;Cochabamba -  Venta -  Departamento;/anuncio/inmuebles/27-900-us-monoambiente/1978826
7;Edificio Tribeca Soho Av;2023-02-24;"EDIFICIO ""TRIBECA SOHO"" Av. Heroínas Esq. Aurelio Melean, oficinas de: 34, 52, 56, 100 mts. del piso 1 al 3. Cel. 74577718, Cel. Of. 72202293.";;Cochabamba -  Venta -  Oficina;/anuncio/inmuebles/edificio-tribeca-soho-av/1978843
8;Dueño Vende Casa Como;2023-02-24;DUEñO vende casa como terreno, barrio periodista, América oeste, 270 mts, $us 145.000. 4422244, 69455890.;$us 145 000;Cochabamba -  Venta -  Casa / Chalet;/anuncio/inmuebles/dueno-vende-casa-como/1979222
9;Vendo Casa A Estrenar;2023-02-24;VENDO casa a estrenar, de 3 pisos, véalo sin compromiso, zona Coña Coña, Km 6, Av. Blanco Galindo al norte, 6 cuadras. 75481717.;;Cochabamba -  Venta -  Casa / Chalet;/anuncio/inmuebles/vendo-casa-estrenar/1979195
10;Casa América Oeste 3;2023-02-24;CASA América oeste, 3 suites, dependencias, $us 130.000, con financiamiento bancario. 76439090.;;Cochabamba -  Venta -  Casa / Chalet;/anuncio/inmuebles/casa-america-oeste-3/1979271
11;Vendo Departamento América Casi;2023-02-24;VENDO Departamento América casi libertador 90 mts 3 dormitorios 2 baños sin garaje. Cel 70744006;;Cochabamba -  Venta -  Departamento;/anuncio/inmuebles/vendo-departamento-america-casi/1979304
12;Vendo Lote De 145;2023-02-24;VENDO Lote de 145 m2 cerca Stadium y Caja CORDES. Referencia 70342614;;Cochabamba -  Venta -  Lote / Terreno;/anuncio/inmuebles/vendo-lote-de-145/1979372
13;Lote De 237 M2;2023-02-24;LOTE de 237 m2, sobre Av. Chapare. Ref. 69530114.;;Cochabamba -  Venta -  Lote / Terreno;/anuncio/inmuebles/lote-de-237-m2/1979373
14;Propietario Vende Lote Con;2023-02-24;PROPIETARIO vende lote, con construcción antigua, 315.57 m2, zona Sarco, c/Araona y Yura care, frente Universidad Domingo Savio. Ref. 76936053, 71712450, 71712333.;;Cochabamba -  Venta -  Lote / Terreno;/anuncio/inmuebles/propietario-vende-lote-con/1979375
15;39 500 $us Tiendas;2023-02-24;39.500 $US tiendas, a la vuelta iglesia Cala Cala. 79786019.;$us 39 500;Cochabamba -  Venta -  Local Comercial;/anuncio/inmuebles/39-500-us-tiendas/1979422
16;Dueña Alquila Departamentos Amplios;2023-02-24;DUEñA alquila departamentos amplios, de 2 o 3 habitaciones, totalmente independiente. Cel. 62994992.;;Cochabamba -  Alquiler -  Departamento;/anuncio/inmuebles/duena-alquila-departamentos-amplios/1979488
17;Casita De 2 Habitaciones;2023-02-24;CASITA de 2 habitaciones y dependencias, sobre Av. Chapare. Ref. 69530114.;;Cochabamba -  Anticrético -  Casa / Chalet;/anuncio/inmuebles/casita-de-2-habitaciones/1979619
18;Casita De 3 Habitaciones;2023-02-24;CASITA de 3 habitaciones y dependencias, sobre Av. Chapare. Ref. 69530114.;;Cochabamba -  Anticrético -  Casa / Chalet;/anuncio/inmuebles/casita-de-3-habitaciones/1979620
19;10 000 $us Parqueo;2023-02-24;10.000 $US parqueo, más baulera, zona Cala Cala, a la vuelta de la iglesia. 79786019.;$us 10 000;Cochabamba -  Anticrético -  Departamento;/anuncio/inmuebles/10-000-us-parqueo/1979682
20;Propietaria Vende Casa En;2023-02-24;PROPIETARIA Vende casa en Irpavi Zona Sur, Construcción 328 m2, superficie 631 m2 Ref. 75901774;;Cochabamba -  Venta -  Casa / Chalet;/anuncio/inmuebles/propietaria-vende-casa-en/1981521
21;Casa En Venta Av;2023-02-24;CASA en venta, Av. Barrientos, Y. Yacuiba Nro 0546, zona centro, una cuadra de la parada de taxis a Cliza y transporte, P. Baja, baño, cocina 3 cuartos amplios, 1 piso, sala comedor, cocina, baño, 2 cuartos, garaje, 2do piso, 3 dormitorios, baño, 180.000 $us. Cel. 76383618, Sup. 221 mts.;$us 180 000;Cochabamba -  Venta -  Casa / Chalet;/anuncio/inmuebles/casa-en-venta-av/1981523
22;En Venta Anticrético O;2023-02-24;EN VENTA Anticrético o alquiler una casa con todos los servicios, Zenaida norte Sacaba km. 6 1/2. 77997585.;;Cochabamba -  Venta -  Casa / Chalet;/anuncio/inmuebles/en-venta-anticretico-o/1981524
23;Vendo Pequeño Departamento Amoblado;2023-02-24;VENDO Pequeño departamento amoblado y equipado, edificio céntrico, 41 m2. Ref. 72048089.;;Cochabamba -  Venta -  Departamento;/anuncio/inmuebles/vendo-pequeno-departamento-amoblado/1981536
24;Ultimos Lotes Zona Itocta;2023-02-24;ULTIMOS lotes, zona Itocta, frente Urb. Bolívar. 75469949, 78300788, 500 mts y 1.000 mts.;;Cochabamba -  Venta -  Lote / Terreno;/anuncio/inmuebles/ultimos-lotes-zona-itocta/1981543
25;Vendo Lote 500 M2;2023-02-24;VENDO lote, 500 m2, Colcapirhua, zona norte, 85.000 $us. 62743524.;$us 85 000;Cochabamba -  Venta -  Lote / Terreno;/anuncio/inmuebles/vendo-lote-500-m2/1981544
26;Vendo Terreno De 1421;2023-02-24;VENDO Terreno de 1421 m2 cerca de la Blanco Galindo - 77264815;;Cochabamba -  Venta -  Lote / Terreno;/anuncio/inmuebles/vendo-terreno-de-1421/1981545
27;Lote En Venta De;2023-02-24;LOTE en venta, de 355 metros, en Chacacollo, llamar. 68532922.;;Cochabamba -  Venta -  Lote / Terreno;/anuncio/inmuebles/lote-en-venta-de/1981546
28;Ocasion Venta Espacio Cementerio;2023-02-24;OCASION Venta espacio cementerio Concordia Colcapirhua Sector Los Cedros Cel. 70357820;;Cochabamba -  Venta -  Varios;/anuncio/inmuebles/ocasion-venta-espacio-cementerio/1981551
29;1 000 Bs Garzonier;2023-02-24;1.000 BS. Garzonier alquiler +patio independiente planta baja todas dependencias Benjo Cruz A 5 pasos Cruce Taquiña 77994624 Whatsapp;;Cochabamba -  Alquiler -  Departamento;/anuncio/inmuebles/1-000-bs-garzonier/1981557
30;Bs 1 900 Departamento;2023-02-24;BS. 1.900 departamento con o sin muebles, con garaje, 2 dormitorios, incluye agua, luz, cable, internet, zona centro de salud Sarcobamba, Rafael Mendoza 1540 Esq. Udaeta. Ref. Cel. 72286100, 71750504, 4522571.;;Cochabamba -  Alquiler -  Departamento;/anuncio/inmuebles/bs-1-900-departamento/1981558
31;En Alquiler Departamentos Amoblados;2023-02-24;EN ALQUILER departamentos amoblados, 2 dormitorios, próximo a plaza Colón. Cel. 71722097.;;Cochabamba -  Alquiler -  Departamento;/anuncio/inmuebles/en-alquiler-departamentos-amoblados/1981559
32;Alquilo Pequeño Garzonier 1;2023-02-24;ALQUILO pequeño garzonier (1 persona), C. Garcilazo de la Vega 0638, entre Guamán Poma y Av. d'Orbigny. Telf. 4241823.;;Cochabamba -  Alquiler -  Departamento;/anuncio/inmuebles/alquilo-pequeno-garzonier-1/1981560
33;1 100 Bs Cruce;2023-02-24;1.100 BS. Cruce Taquiña bonito garzonier alquiler 1Dormitorio +roperos empotrados dependencias patio 77994624 Whatsapp;;Cochabamba -  Alquiler -  Departamento;/anuncio/inmuebles/1-100-bs-cruce/1981561
34;En Alquiler Sala Para;2023-02-24;EN ALQUILER sala para reuniones, capacidad 35 personas, próximo plaza Colón. Cel. 71722097.;;Cochabamba -  Alquiler -  Local Comercial;/anuncio/inmuebles/en-alquiler-sala-para/1981562
35;2 Cuartos En Alquiler;2023-02-24;2 CUARTOS en alquiler, con cocina, con gas domiciliario, baño independiente, zona Temporal, calle Mostajo y Quevedo. Telf. 77490619.;;Cochabamba -  Alquiler -  Habitación;/anuncio/inmuebles/2-cuartos-en-alquiler/1981563
36;Alquiler Habitación Céntrica Amoblado;2023-02-24;ALQUILER habitación, céntrica, amoblado, para estudiante, cerca a Universidades, Paccieri, Oquendo. 69529060, 4534490.;;Cochabamba -  Alquiler -  Habitación;/anuncio/inmuebles/alquiler-habitacion-centrica-amoblado/1981564
37;Alquiler Habitaciones Cerca Umss;2023-02-24;ALQUILER habitaciones, cerca UMSS, Hospital Viedma, facultad Medicina, Odontología, para estudiantes o persona sola. 79368609.;;Cochabamba -  Alquiler -  Habitación;/anuncio/inmuebles/alquiler-habitaciones-cerca-umss/1981565
38;Casa En Anticrético Consta;2023-02-24;CASA en anticrético, consta de 3 apartamentos en cada planta, independiente, con garaje, jardín y patio amplio, apto para restaurante, consta de 500 m2, ubicado en pacata Baja, Villa Barrientos, calle Monte Alegre, llame. 65614608.;;Cochabamba -  Anticrético -  Casa / Chalet;/anuncio/inmuebles/casa-en-anticretico-consta/1981570
39;Vivienda Independiente 25 000;2023-02-24;VIVIENDA independiente, 25.000 $us, zona Hipódromo. Cel. 75967364, 60702881.;;Cochabamba -  Anticrético -  Casa / Chalet;/anuncio/inmuebles/vivienda-independiente-25-000/1981571
40;Casa Anticrético Independiente Zona;2023-02-24;CASA anticrético, independiente, zona Chimba, noreste. 68444822, 71432005.;;Cochabamba -  Anticrético -  Casa / Chalet;/anuncio/inmuebles/casa-anticretico-independiente-zona/1981572
41;Anticretico Departamentos Cómodos 2;2023-02-24;ANTICRETICO departamentos cómodos, 2 - 3 dormitorios, con garaje, Av. Killman, entrega inmediata. 77967040, 4509099, propietaria.;;Cochabamba -  Anticrético -  Departamento;/anuncio/inmuebles/anticretico-departamentos-comodos-2/1981578
42;Departamento En Anticrético Consta;2023-02-24;DEPARTAMENTO En anticrético consta de 3 dormitorios sala cocina 2 baños zona terminal Quillacollo norte Telf. 72748114, 76927660;;Cochabamba -  Anticrético -  Departamento;/anuncio/inmuebles/departamento-en-anticretico-consta/1981579
43;Cuarto Amplio En Anticrético;2023-02-24;CUARTO amplio, en anticrético (5x10m2), zona Alalay, 5.500 $us. Cel. 75990064.;;Cochabamba -  Anticrético -  Oficina;/anuncio/inmuebles/cuarto-amplio-en-anticretico/1981580
44;Santa Cruz Calle Libertad;2023-02-24;SANTA CRUZ Calle Libertad entre Buenos Aires y Florida, $us 395.000, 588 mts2. Ubicado en el centro histórico, a una cuadra de la plaza principal 24 de Septiembre, Telf. 72142899.;$us 395 000;Cochabamba -  Venta -  Lote / Terreno;/anuncio/inmuebles/santa-cruz-calle-libertad/1980857
45;Casa En Anticrético O;2023-02-24;CASA En anticrético o alquiler, zona sud, Itocta, dormitorios, cocina, baño, salita, garaje 8.000 $us. 72721631.;$us 8 000;Cochabamba -  Anticrético -  Casa / Chalet;/anuncio/inmuebles/casa-en-anticretico-o/1980871
46;Casa En Venta Zona;2023-02-24;CASA en venta, zona Arocagua. Ref. 70341790, el propietario.;;Cochabamba -  Venta -  Casa / Chalet;/anuncio/inmuebles/casa-en-venta-zona/1981060
47;Departamentos Condominio Ubuntu A;2023-02-24;DEPARTAMENTOS  Condominio Ubuntu. A 3 cuadras de la Plaza de Cala - Cala. Torre de 25 pisos de entrega inmediata. Supervisión de Obra: Ing. Pablo Soto Quiroga. Cel: 71460400. Últimos Departamentos.;;Cochabamba -  Venta -  Departamento;/anuncio/inmuebles/departamentos-condominio-ubuntu/1981066
48;Departamentos Condominio Oomoto En;2023-02-24;DEPARTAMENTOS Condominio Oomoto. En Tiquipaya próximo al Colegio Tiquipaya. Más de 1 Hectárea de áreas comunes: 3 piscinas atemperadas, cabañas de churrasqueros, gimnasio y campos deportivos. Supervisión de Obra: Ing. Pablo Soto Quiroga. Cel: 71460400.;;Cochabamba -  Venta -  Departamento;/anuncio/inmuebles/departamentos-condominio-oomoto-en/1981067
49;Departamentos Condominio Villa Fratterna;2023-02-24;DEPARTAMENTOS Condominio Villa Fratterna. Es como vivir en un Hotel de *****. vive en comunidad. Supervisión de Obra: Ing. Pablo Soto Quiroga. Cel: 71460400.;;Cochabamba -  Venta -  Departamento;/anuncio/inmuebles/departamentos-condominio-villa-fratterna/1981068
50;Hermoso Departamento En Venta;2023-02-24;HERMOSO departamento en venta, de 2 dormitorios, edificio Patmos (plaza Cala Cala), trato directo con el propietario. Cel. 77927700.;;Cochabamba -  Venta -  Departamento;/anuncio/inmuebles/hermoso-departamento-en-venta/1981069
51;Lote De Ocasión En;2023-02-24;LOTE De ocasión en venta 259 m2 zona Piñami precio 64 $ celular 62777135;;Cochabamba -  Venta -  Lote / Terreno;/anuncio/inmuebles/lote-de-ocasion-en/1981077
52;Sobre Avenida Pando Y;2023-02-24;SOBRE AVENIDA PANDO Y PORTALES Hupermall piso 7 departamento amplio 184 m2, 1 garaje, (3 suite) escritorio, 2 patios internos. Anticrético 50.000 $us. documentos al día Ref. 71039425;$us 50 000;Cochabamba -  Anticrético -  Departamento;/anuncio/inmuebles/sobre-avenida-pando-y/1981097
53;Hermosa Casa Para Vivienda;2023-02-24;HERMOSA casa para vivienda y oficina, inmediaciones Cine Center, Cel./WP. 75900145, 530 m2.;;Cochabamba -  Venta -  Casa / Chalet;/anuncio/inmuebles/hermosa-casa-para-vivienda/1981298
54;Departamento Pentohuse Duplex 3;2023-02-24;DEPARTAMENTO pentohuse, duplex, 3 dormitorios, 3 baños, parrillero, jacuzzi, sauna, parqueo, 3 movilidades, WP. 75900145.;;Cochabamba -  Venta -  Departamento;/anuncio/inmuebles/departamento-pentohuse-duplex-3/1981305
55;Oficina Equipada Gerencia Subgerencia;2023-02-24;OFICINA equipada, gerencia, subgerencia, recibidor, 2 baños, cocineta, 2 garajes, baulera, inmediaciones Prado, WP. 75900145.;;Cochabamba -  Venta -  Oficina;/anuncio/inmuebles/oficina-equipada-gerencia-subgerencia/1981310
56;Local Comercial Salida A;2023-02-24;LOCAL COMERCIAL salida a calle, c/garaje, baño, cocineta, inmediaciones Estadium, Cel./WP. 75900145.;;Cochabamba -  Venta -  Local Comercial;/anuncio/inmuebles/local-comercial-salida/1981311
57;Vendo Edificio 4 Departamentos;2023-02-24;VENDO edificio, 4 departamentos, 156 m2, c/uno, 3 garajes, área social, Frutillar, 420.000 $us. 70774400.;;Cochabamba -  Venta -  Edificios;/anuncio/inmuebles/vendo-edificio-4-departamentos/1981312
58;Alquiler Departamento Junín Reza;2023-02-24;ALQUILER departamento, Junín, Reza, 3 dormitorios, 2.200 Bs. dependencias, garaje, patio, 2 baños, whatsapp. 76933557, 4522525.;;Cochabamba -  Alquiler -  Departamento;/anuncio/inmuebles/alquiler-departamento-junin-reza/1981316
59;Alquilo Departamentos 3 Dormitorios;2023-02-24;ALQUILO departamentos, 3 dormitorios, dependencias completas, garaje, 4ta, 5ta planta, 330 $us, zona Hipermaxi, Juan de la Rosa. 4246859, 70774400.;;Cochabamba -  Alquiler -  Departamento;/anuncio/inmuebles/alquilo-departamentos-3-dormitorios/1981317
60;Casa Anticrético 2 Dormitorios;2023-02-24;CASA anticrético, 2 dormitorios, Villa Taquiña. Cel. 69458780.;;Cochabamba -  Anticrético -  Casa / Chalet;/anuncio/inmuebles/casa-anticretico-2-dormitorios/1981326
61;Departamento En Anticrético En;2023-02-24;DEPARTAMENTO en anticrético, en edificio San Pedro de Alcantara, Av. Melchor Perez de Holguín 1480, consta de 3 dormitorios, 1 en suite, 3 baños, sala, comedor, cocina, despensa, sala de lavado, baulera y garaje, sin hipoteca. Cel. 71019743.;;Cochabamba -  Anticrético -  Departamento;/anuncio/inmuebles/departamento-en-anticretico-en/1981327
62;Anticretico Departamento 3 Dormitorios;2023-02-24;ANTICRETICO departamento, 3 dormitorios, 2 baños, cocina, living comedor, todo amoblado, parqueo, whatsapp. 67489177.;;Cochabamba -  Anticrético -  Departamento;/anuncio/inmuebles/anticretico-departamento-3-dormitorios/1981329
63;Oficina Céntrica En Alquiler;2023-02-23;OFICINA céntrica en alquiler. 79380485.;;Cochabamba -  Alquiler -  Oficina;/anuncio/inmuebles/oficina-centrica-en-alquiler/1972253
64;Departamento Céntrico En Alquiler;2023-02-23;DEPARTAMENTO céntrico, en alquiler. 70774733.;;Cochabamba -  Alquiler -  Departamento;/anuncio/inmuebles/departamento-centrico-en-alquiler/1976100
65;Urbanizacion Bella Vista Cochabamba;2023-02-23;URBANIZACION BELLA VISTA Cochabamba, hermosa casa, estilo vanguardista, detalles. Telèfono 65244969;;Cochabamba -  Venta -  Casa / Chalet;/anuncio/inmuebles/urbanizacion-bella-vista-cochabamba/1978821
66;Vendo Once Lotes De;2023-02-23;VENDO Once lotes de 250 mt2 juntos El Abra frente INBOLTECO Av. Octava Cel. 76977447;;Cochabamba -  Venta -  Lote / Terreno;/anuncio/inmuebles/vendo-once-lotes-de/1979358
67;En Tiquipaya Casa Independiente;2023-02-23;EN TIQUIPAYA casa independiente, en alquiler, zona central, frente al Banco PRODEM, ideal para vivienda y negocio. Ref. Cel. 72214136, 70758369.;;Cochabamba -  Alquiler -  Casa / Chalet;/anuncio/inmuebles/en-tiquipaya-casa-independiente/1979448
68;Alquilo Garzonier Con Garaje;2023-02-23;ALQUILO garzonier, con garaje, edificio Gusot, Ramón Rivero 945. Cel. 72273320.;;Cochabamba -  Alquiler -  Departamento;/anuncio/inmuebles/alquilo-garzonier-con-garaje/1979520
69;Requiero Alquiler Deposito Galpón;2023-02-23;REQUIERO Alquiler deposito, galpón o garaje pequeño para guardar muebles inmediaciones Quintanilla, Tupuraya, Estadio 76977447;;Cochabamba -  Alquiler -  Demanda;/anuncio/inmuebles/requiero-alquiler-deposito-galpon/1979612
70;Departamento Tercer Piso Anticrético;2023-02-23;DEPARTAMENTO Tercer piso anticrético d’Orbigny, Juan Pablo II . 72262797.;;Cochabamba -  Anticrético -  Departamento;/anuncio/inmuebles/departamento-tercer-piso-anticretico/1980875
71;18 000 $us Anticrético;2023-02-23;18,000 $US, Anticrético departamento 2 dormitorios estrenar Lomas Aranjuez 79795225;;Cochabamba -  Anticrético -  Departamento;/anuncio/inmuebles/18-000-us-anticretico/1981098
72;De Ocasion Anticrético O;2023-02-23;DE OCASION anticrético o venta departamento de lujo,1 master suite, 2 suites, living comedor, cocina, 4 baños, garaje, área de lavado, balcones, cortinas, lámparas, superficie 180 m2, avenida Portales, zona Queru Queru. Ref. 70344447, 4067474.;;Cochabamba -  Anticrético -  Departamento;/anuncio/inmuebles/de-ocasion-anticretico-o/1981099
73;1 100 Bs Cruce;2023-02-23;1.100 BS. Cruce Taquiña garzonier alquiler planta baja 1 dormitorio c/roperos empotrados dependencias completas 77994624;;Cochabamba -  Alquiler -  Departamento;/anuncio/inmuebles/1-100-bs-cruce/1981318
74;1 500 Bs Cruce;2023-02-23;1.500 BS. Cruce Taquiña departamento alquiler 2 dormitorios +roperos empotrados dependencias garaje moto 77994624 Whatsapp;;Cochabamba -  Alquiler -  Departamento;/anuncio/inmuebles/1-500-bs-cruce/1981319
75;Departamento 210 $us 2;2023-02-23;DEPARTAMENTO 210 $us, 2 dormitorios, living, cocina, familia reducida, Ladislao Cabrera 562 casi Lanza. 70772020.;;Cochabamba -  Alquiler -  Departamento;/anuncio/inmuebles/departamento-210-us-2/1981320
76;Propietario Alquila Un Departamento;2023-02-23;PROPIETARIO  Alquila un departamento de dos dormitorios cerca a EPI Norte 70733482 4474673;$us 2 300;Cochabamba -  Alquiler -  Departamento;/anuncio/inmuebles/propietario-alquila-un-departamento/1981321
77;Propietario Alquila Tienda Y;2023-02-23;PROPIETARIO alquila tienda y trastienda, c/baño privado, zona central, whatsapp. 77905475.;;Cochabamba -  Alquiler -  Local Comercial;/anuncio/inmuebles/propietario-alquila-tienda-y/1981323
78;25 000 $us Estrenar;2023-02-23;25.000 $US. Estrenar departamento anticrético 3 dormitorios (1 en suite) gas calefón roperos cocina empotrada garaje Beijing Tadeo Haenke 77994624 Whatsapp;;Cochabamba -  Anticrético -  Departamento;/anuncio/inmuebles/25-000-us-estrenar/1981333
79;Doy 2 Cuartos En;2023-02-22;DOY 2 CUARTOS en anticrético, baño independiente, patio grande y lavandería (zona norte, Melchor Perez y Kausillo). Ref. 75499396, 78306074.;;Cochabamba -  Anticrético -  Habitación;/anuncio/inmuebles/doy-2-cuartos-en/1978638
80;Dueño Vende En Canarrancho;2023-02-22;DUEñO VENDE en Canarrancho, zona Santiaguilla, hay un mercadito, 2 chalets, a estrenar, amoblados, Sup. 198 m2, c/u y 3 lotes, 2 de 500 m2 y 400 m2, con 2 frentes, Av. Santa cruz y calle Innominada, documentos al día, acepto financiamiento. 75921115, 78348239.;;Cochabamba -  Venta -  Departamento;/anuncio/inmuebles/dueno-vende-en-canarrancho/1979301
81;Propietario Vende Lotes En;2023-02-22;PROPIETARIO Vende lotes en urbanización zona Coña Coña Colcapirhua de 250 a 400 m2 con documentos en orden precios económicos Ref. 67498340;;Cochabamba -  Venta -  Lote / Terreno;/anuncio/inmuebles/propietario-vende-lotes-en/1979359
82;Lote $us 75 000;2023-02-22;LOTE $us 75.000, 305.91 m2, zona norte, Candelaria, todos los servicios, propietario. 69807425, en esquina.;$us 75 000;Cochabamba -  Venta -  Lote / Terreno;/anuncio/inmuebles/lote-us-75-000/1979374
83;Parque Demetrio Canelas Bonito;2023-02-22;PARQUE DEMETRIO CANELAS Bonito departamento, en alquiler, 4 dormitorios, living comedor, cocina, baño, garaje. Cel. 74307647.;;Cochabamba -  Alquiler -  Departamento;/anuncio/inmuebles/parque-demetrio-canelas-bonito/1979505
84;Alquiler O Anticrético Monoambiente;2023-02-22;ALQUILER o anticrético, monoambiente (2 personas), en la Lanza y Brasil. Ref. 70352246.;;Cochabamba -  Alquiler -  Departamento;/anuncio/inmuebles/alquiler-o-anticretico-monoambiente/1979542
85;Anticretico Local Comercial Independiente;2023-02-22;ANTICRETICO Local comercial independiente por estrenar, 70 mts2. Anìbal Capriles, 530 frente, plaza Incacollo, Muyurina. 70717160, 4230435;;Cochabamba -  Anticrético -  Local Comercial;/anuncio/inmuebles/anticretico-local-comercial-independiente/1979696
86;Hermosa Casa Para Vivienda;2023-02-22;HERMOSA casa para vivienda u oficina, inmediaciones Cine Center, Cel./WP. 75900145, 530 m2.;;Cochabamba -  Venta -  Casa / Chalet;/anuncio/inmuebles/hermosa-casa-para-vivienda/1980844
87;Departamento Penthouse Duplex 3;2023-02-22;DEPARTAMENTO penthouse duplex, 3 dormitorios, 3 baños, parrillero, jacuzzi, sauna, parqueo, 3 movilidades. WP. 75900145.;;Cochabamba -  Venta -  Departamento;/anuncio/inmuebles/departamento-penthouse-duplex-3/1980853
88;Oficina Equipada Gerencia Subgerencia;2023-02-22;OFICINA equipada, gerencia, subgerencia, recibidor, 2 baños, cocineta, 2 garajes, baulera, inmediaciones Prado WP. 75900145.;;Cochabamba -  Venta -  Oficina;/anuncio/inmuebles/oficina-equipada-gerencia-subgerencia/1980859
89;Local Comercial Salida A;2023-02-22;LOCAL COMERCIAL salida a calle, c/garaje, baño, cocineta, inmediaciones Estadium, Cel. WP. 75900145.;;Cochabamba -  Venta -  Local Comercial;/anuncio/inmuebles/local-comercial-salida/1980861
90;Anticretico Departamento 3 Dormitorios;2023-02-22;ANTICRETICO departamento, 3 dormitorios, 2 baños, cocina, living comedor, todo amoblado, parqueo, whatsapp. 67489177.;;Cochabamba -  Anticrético -  Departamento;/anuncio/inmuebles/anticretico-departamento-3-dormitorios/1980876
91;Casita En Anticretico Entrega;2023-02-22;CASITA  En anticretico, entrega inmediata, 10 mil dólares, todo independiente. Zona: Temporal. Cel: 62714055;;Cochabamba -  Anticrético -  Casa / Chalet;/anuncio/inmuebles/casita-en-anticretico-entrega/1981034
92;Lote En Venta Zona;2023-02-22;LOTE En venta, zona Esquilan 480 m2 sector Km 10 1/2 Blanco Galindo 33.800 $. Ref. 77937018, 76919796;$us 33 800;Cochabamba -  Venta -  Lote / Terreno;/anuncio/inmuebles/lote-en-venta-zona/1981076
93;Alquiler Casa Con Todas;2023-02-22;ALQUILER casa, con todas las dependencias, Av. Costanera, parque de la Familia. 71734494.;;Cochabamba -  Alquiler -  Casa / Chalet;/anuncio/inmuebles/alquiler-casa-con-todas/1981082
94;2 200 Bs Alquiler;2023-02-22;2.200 BS. Alquiler casa independiente 3Dormitorios dependencias gas garaje patio Próximo Av. Ecológica Aldeas SOS 77994624;;Cochabamba -  Alquiler -  Casa / Chalet;/anuncio/inmuebles/2-200-bs-alquiler/1981083
95;2 200 Bs Av;2023-02-22;2.200 BS. Av. Santa Cruz Aniceto Padilla Bata alquiler departamento amplio 3 dormitorios roperos escritorio dependencias garaje 77994624 Whatsapp;;Cochabamba -  Alquiler -  Departamento;/anuncio/inmuebles/2-200-bs-av/1981087
96;1 500 Bs Cruce;2023-02-22;1.500 BS. Cruce Taquiña departamento alquiler 2 dormitorios roperos empotrados dependencias garaje moto 77994624 Whatsapp;;Cochabamba -  Alquiler -  Departamento;/anuncio/inmuebles/1-500-bs-cruce/1981088
97;1 500 Bs Temporal;2023-02-22;1.500 BS. Temporal Cala Cala departamento alquiler 3 dormitorios dependencias completas garaje entrega inmediata 77994624 whatsapp;;Cochabamba -  Alquiler -  Departamento;/anuncio/inmuebles/1-500-bs-temporal/1981089
98;Departamento En Anticrético 3;2023-02-22;DEPARTAMENTO En anticrético, 3 dormitorios, 2 baños, cocina cajonería alta y baja, living y comedor Tel. 75467942. Zona parque Lincoln.;;Cochabamba -  Anticrético -  Departamento;/anuncio/inmuebles/departamento-en-anticretico-3/1981096
